{
  "$schema": "./tokens.schema.json",
  "color": {
    "ramp": {
      "navy": {
        "50": "#F2F7FE",
        "100": "#E4EEFA",
        "200": "#CEDEF2",
        "300": "#B1C8E5",
        "400": "#94B4DB",
        "500": "#789FCE",
        "600": "#5E83AF",
        "700": "#44658E",
        "800": "#27466B",
        "900": "#03274D",
        "950": "#00112D"
      },
      "teal": {
        "50": "#ECFAFA",
        "100": "#D8F3F3",
        "200": "#B9E7E6",
        "300": "#8FD4D4",
        "400": "#5DC4C4",
        "500": "#0DB2B3",
        "600": "#009596",
        "700": "#007677",
        "800": "#005557",
        "900": "#003639",
        "950": "#001B1F"
      }
    },
    "cssRamp": {
      "navy": {
        "50": "oklch(0.975 0.01 253.54)",
        "100": "oklch(0.945 0.019 253.54)",
        "200": "oklch(0.895 0.032 253.54)",
        "300": "oklch(0.825 0.048 253.54)",
        "400": "oklch(0.76 0.066 253.54)",
        "500": "oklch(0.692 0.081 253.54)",
        "600": "oklch(0.6 0.08 253.54)",
        "700": "oklch(0.5 0.076 253.54)",
        "800": "oklch(0.39 0.073 253.54)",
        "900": "oklch(0.273 0.081 253.54)",
        "950": "oklch(0.18 0.066 253.54)"
      },
      "teal": {
        "50": "oklch(0.975 0.015 195.52)",
        "100": "oklch(0.945 0.028 195.52)",
        "200": "oklch(0.895 0.047 195.52)",
        "300": "oklch(0.825 0.07 195.52)",
        "400": "oklch(0.76 0.096 195.52)",
        "500": "oklch(0.692 0.117 195.52)",
        "600": "oklch(0.6 0.115 195.52)",
        "700": "oklch(0.5 0.11 195.52)",
        "800": "oklch(0.39 0.105 195.52)",
        "900": "oklch(0.273 0.117 195.52)",
        "950": "oklch(0.18 0.096 195.52)"
      }
    },
    "fixed": { "white": "#FFFFFF", "destructiveLight": "#E7000B", "destructiveDark": "#FF6467" },
    "semantic": {
      "light": {
        "background": "fixed.white",
        "foreground": "ramp.navy.900",
        "card": "fixed.white",
        "cardForeground": "ramp.navy.900",
        "popover": "fixed.white",
        "popoverForeground": "ramp.navy.900",
        "primary": "ramp.navy.900",
        "primaryForeground": "ramp.navy.50",
        "secondary": "ramp.navy.50",
        "secondaryForeground": "ramp.navy.800",
        "muted": "ramp.navy.50",
        "mutedForeground": "ramp.navy.700",
        "accent": "ramp.teal.50",
        "accentForeground": "ramp.teal.800",
        "brand": "ramp.teal.500",
        "brandForeground": "ramp.navy.900",
        "brandSubtle": "ramp.teal.50",
        "brandSubtleForeground": "ramp.teal.800",
        "destructive": "fixed.destructiveLight",
        "border": "ramp.navy.200",
        "input": "ramp.navy.200",
        "ring": "ramp.teal.500",
        "chart1": "ramp.teal.500",
        "chart2": "ramp.navy.600",
        "chart3": "ramp.teal.700",
        "chart4": "ramp.navy.300",
        "chart5": "ramp.teal.300",
        "sidebar": "ramp.navy.50",
        "sidebarForeground": "ramp.navy.900",
        "sidebarPrimary": "ramp.navy.900",
        "sidebarPrimaryForeground": "ramp.navy.50",
        "sidebarAccent": "ramp.teal.50",
        "sidebarAccentForeground": "ramp.teal.800",
        "sidebarBorder": "ramp.navy.200",
        "sidebarRing": "ramp.teal.500",
        "pageBackground": "fixed.white",
        "surface": "ramp.navy.50",
        "textPrimary": "ramp.navy.900",
        "textSecondary": "ramp.navy.700",
        "textAccent": "ramp.teal.700"
      },
      "dark": {
        "background": "ramp.navy.950",
        "foreground": "ramp.navy.50",
        "card": "ramp.navy.900",
        "cardForeground": "ramp.navy.50",
        "popover": "ramp.navy.900",
        "popoverForeground": "ramp.navy.50",
        "primary": "ramp.teal.500",
        "primaryForeground": "ramp.navy.950",
        "secondary": "ramp.navy.800",
        "secondaryForeground": "ramp.navy.50",
        "muted": "ramp.navy.900",
        "mutedForeground": "ramp.navy.400",
        "accent": "ramp.navy.800",
        "accentForeground": "ramp.teal.300",
        "brand": "ramp.teal.500",
        "brandForeground": "ramp.navy.950",
        "brandSubtle": "ramp.teal.900",
        "brandSubtleForeground": "ramp.teal.300",
        "destructive": "fixed.destructiveDark",
        "border": "ramp.navy.800",
        "input": "ramp.navy.800",
        "ring": "ramp.teal.500",
        "chart1": "ramp.teal.400",
        "chart2": "ramp.navy.400",
        "chart3": "ramp.teal.600",
        "chart4": "ramp.navy.600",
        "chart5": "ramp.teal.200",
        "sidebar": "ramp.navy.900",
        "sidebarForeground": "ramp.navy.50",
        "sidebarPrimary": "ramp.teal.500",
        "sidebarPrimaryForeground": "ramp.navy.950",
        "sidebarAccent": "ramp.navy.800",
        "sidebarAccentForeground": "ramp.teal.300",
        "sidebarBorder": "ramp.navy.800",
        "sidebarRing": "ramp.teal.500",
        "pageBackground": "ramp.navy.950",
        "surface": "ramp.navy.900",
        "textPrimary": "ramp.navy.50",
        "textSecondary": "ramp.navy.400",
        "textAccent": "ramp.teal.300"
      }
    }
  },
  "spacing": { "xs": 6, "sm": 8, "md": 12, "lg": 16, "xl": 20, "2xl": 24, "3xl": 28, "4xl": 40 },
  "radius": { "card": 12, "brandMark": 14 },
  "size": { "brandMark": 56, "primaryButtonMinimumHeight": 48, "contentMaximumWidth": 560 }
}
